<?xml version="1.0" encoding="UTF-8"?>
<documentation xmlns:xsi="http://www.w3.org/2001/XMLSchema-instance" xsi:noNamespaceSchemaLocation="documentation.xsd">
  <!-- mandatory fields: author, category, updated, description -->
  <info>
    <!-- forename lastname -->
    <author>Michael Kluge</author>
    <!-- day the module was updated the last time -->
    <updated>2019-03-13</updated>
    <category>General</category>
    <description maxVersion="1" minVersion="1">pauses for a specified amount of time</description>
    <!-- ##### optional ##### -->
    <!-- website of the dependencies used in this module -->
    <website>https://www.gnu.org/software/coreutils/sleep</website>
    <!-- external dependencies required for that module -->
    <dependencies maxVersion="1" minVersion="1">GNU sleep</dependencies>
  </info>
  <!-- ##### optional ##### -->
  <!-- github usernames of users who should be able to commit changes to that module -->
  <maintainer>
    <username>klugem</username>
  </maintainer>
  <parameter>
    <!-- mandatory fields per parameter: name, type, description -->
    <!-- optional fields per parameter: restrictions, default, minOccurs, maxOccurs, minVersion, maxVersion -->
    <param maxOccurs="1" minOccurs="1" name="wait" type="string" restrictions="[0-9]+[smhd]{0,1}">
      <description>non-negative number followed by an optional unit; the default is seconds; valid units: seconds (s), minutes(m), hours (h), days (d)</description>
    </param>
  </parameter>
</documentation>
